{
  "schema": "agent-memory-staging-internal-alpha-input-v1",
  "classification": "staging_external",
  "environment": "staging",
  "cohort_id": "internal-alpha-2026-07",
  "review_version": "product-qa-operations-v1",
  "inventory_id": "staging-inventory-v1",
  "inventory_receipt_sha256": "aaaaaaaaaaaaaaaaaaaaaaaaaaaaaaaaaaaaaaaaaaaaaaaaaaaaaaaaaaaaaaaa",
  "plan_id": "staging-plan-v1",
  "plan_receipt_sha256": "bbbbbbbbbbbbbbbbbbbbbbbbbbbbbbbbbbbbbbbbbbbbbbbbbbbbbbbbbbbbbbbb",
  "change_id": "staging-change-v1",
  "change_receipt_sha256": "cccccccccccccccccccccccccccccccccccccccccccccccccccccccccccccccc",
  "release_id": "staging-release-v1",
  "release_receipt_sha256": "dddddddddddddddddddddddddddddddddddddddddddddddddddddddddddddddd",
  "journey_receipt_sha256": "eeeeeeeeeeeeeeeeeeeeeeeeeeeeeeeeeeeeeeeeeeeeeeeeeeeeeeeeeeeeeeee",
  "cohort_decision_sha256": "4444444444444444444444444444444444444444444444444444444444444444",
  "source_policy_sha256": "5555555555555555555555555555555555555555555555555555555555555555",
  "support_policy_sha256": "6666666666666666666666666666666666666666666666666666666666666666",
  "deletion_manifest_sha256": "7777777777777777777777777777777777777777777777777777777777777777",
  "trace_audit_manifest_sha256": "8888888888888888888888888888888888888888888888888888888888888888",
  "product_qa_operations_review_sha256": "9999999999999999999999999999999999999999999999999999999999999999",
  "started_at": "2026-06-01T00:00:00Z",
  "completed_at": "2026-07-06T00:00:00Z",
  "generated_at": "2026-07-06T01:00:00Z",
  "ready": true,
  "account_count": 3,
  "approved_source_count_cap": 10,
  "approved_source_bytes_cap": 1000,
  "source_count": 8,
  "source_bytes": 800,
  "formats": [
    {"id": "pdf", "source_count": 2, "source_bytes": 200, "indexed_count": 2, "non_sensitive_count": 2, "deleted_count": 2, "evidence_sha256": "1111111111111111111111111111111111111111111111111111111111111111"},
    {"id": "epub", "source_count": 2, "source_bytes": 200, "indexed_count": 2, "non_sensitive_count": 2, "deleted_count": 2, "evidence_sha256": "2222222222222222222222222222222222222222222222222222222222222222"},
    {"id": "markdown", "source_count": 2, "source_bytes": 200, "indexed_count": 2, "non_sensitive_count": 2, "deleted_count": 2, "evidence_sha256": "3333333333333333333333333333333333333333333333333333333333333333"},
    {"id": "text", "source_count": 2, "source_bytes": 200, "indexed_count": 2, "non_sensitive_count": 2, "deleted_count": 2, "evidence_sha256": "aaaaaaaaaaaaaaaaaaaaaaaaaaaaaaaaaaaaaaaaaaaaaaaaaaaaaaaaaaaaaaaa"}
  ],
  "stages": [
    {"id": "invitation_acceptance", "outcome": "passed", "completed_at": "2026-06-01T01:00:00Z", "evidence_sha256": "1111111111111111111111111111111111111111111111111111111111111111"},
    {"id": "signup", "outcome": "passed", "completed_at": "2026-06-01T02:00:00Z", "evidence_sha256": "1111111111111111111111111111111111111111111111111111111111111111"},
    {"id": "rights_consent", "outcome": "passed", "completed_at": "2026-06-01T03:00:00Z", "evidence_sha256": "1111111111111111111111111111111111111111111111111111111111111111"},
    {"id": "source_upload", "outcome": "passed", "completed_at": "2026-06-01T04:00:00Z", "evidence_sha256": "1111111111111111111111111111111111111111111111111111111111111111"},
    {"id": "indexing", "outcome": "passed", "completed_at": "2026-06-01T05:00:00Z", "evidence_sha256": "1111111111111111111111111111111111111111111111111111111111111111"},
    {"id": "search_query", "outcome": "passed", "completed_at": "2026-06-01T06:00:00Z", "evidence_sha256": "1111111111111111111111111111111111111111111111111111111111111111"},
    {"id": "memory_review", "outcome": "passed", "completed_at": "2026-06-01T07:00:00Z", "evidence_sha256": "1111111111111111111111111111111111111111111111111111111111111111"},
    {"id": "export", "outcome": "passed", "completed_at": "2026-06-01T08:00:00Z", "evidence_sha256": "1111111111111111111111111111111111111111111111111111111111111111"},
    {"id": "monthly_consent_renewal", "outcome": "passed", "completed_at": "2026-07-01T03:00:00Z", "evidence_sha256": "1111111111111111111111111111111111111111111111111111111111111111"},
    {"id": "source_deletion", "outcome": "passed", "completed_at": "2026-07-05T00:00:00Z", "evidence_sha256": "1111111111111111111111111111111111111111111111111111111111111111"},
    {"id": "account_deletion", "outcome": "passed", "completed_at": "2026-07-06T00:00:00Z", "evidence_sha256": "1111111111111111111111111111111111111111111111111111111111111111"}
  ],
  "support": {
    "case_count": 2,
    "resolved_case_count": 2,
    "open_case_count": 0,
    "overdue_case_count": 0,
    "sampled_case_count": 2,
    "matched_sample_count": 2,
    "acknowledgement_target_seconds": 900,
    "resolution_target_seconds": 86400,
    "max_acknowledgement_seconds": 600,
    "max_resolution_seconds": 7200,
    "evidence_sha256": "6666666666666666666666666666666666666666666666666666666666666666"
  },
  "deletion": {
    "account_requested_count": 3,
    "account_deleted_count": 3,
    "account_pending_count": 0,
    "source_requested_count": 8,
    "source_deleted_count": 8,
    "source_pending_count": 0,
    "evidence_sha256": "7777777777777777777777777777777777777777777777777777777777777777"
  },
  "checks": [
    {"id": "cohort_approval_complete", "outcome": "passed", "evidence_sha256": "4444444444444444444444444444444444444444444444444444444444444444"},
    {"id": "source_caps_respected", "outcome": "passed", "evidence_sha256": "5555555555555555555555555555555555555555555555555555555555555555"},
    {"id": "non_sensitive_sources_verified", "outcome": "passed", "evidence_sha256": "aaaaaaaaaaaaaaaaaaaaaaaaaaaaaaaaaaaaaaaaaaaaaaaaaaaaaaaaaaaaaaaa"},
    {"id": "all_formats_processed", "outcome": "passed", "evidence_sha256": "aaaaaaaaaaaaaaaaaaaaaaaaaaaaaaaaaaaaaaaaaaaaaaaaaaaaaaaaaaaaaaaa"},
    {"id": "lifecycle_complete", "outcome": "passed", "evidence_sha256": "aaaaaaaaaaaaaaaaaaaaaaaaaaaaaaaaaaaaaaaaaaaaaaaaaaaaaaaaaaaaaaaa"},
    {"id": "support_process_exercised", "outcome": "passed", "evidence_sha256": "6666666666666666666666666666666666666666666666666666666666666666"},
    {"id": "deletion_reconciled", "outcome": "passed", "evidence_sha256": "7777777777777777777777777777777777777777777777777777777777777777"},
    {"id": "immutable_trace_audit_complete", "outcome": "passed", "evidence_sha256": "8888888888888888888888888888888888888888888888888888888888888888"},
    {"id": "product_qa_operations_review_complete", "outcome": "passed", "evidence_sha256": "9999999999999999999999999999999999999999999999999999999999999999"}
  ]
}
